{
  "$schema": "https://json-schema.org/draft/2020-12/schema",
  "$id": "https://github.com/onurcan-b/acik-mevzuat/blob/main/semalar/kanun.schema.json",
  "title": "TurkishLawDocument",
  "type": "object",
  "required": [
    "law_number",
    "title",
    "slug",
    "accepted_date",
    "effective_status",
    "official_gazette",
    "source_url",
    "language"
  ],
  "properties": {
    "law_number": {
      "type": "string"
    },
    "title": {
      "type": "string",
      "minLength": 1
    },
    "slug": {
      "type": "string",
      "pattern": "^[a-z0-9-]+$"
    },
    "accepted_date": {
      "type": ["string", "null"],
      "format": "date"
    },
    "effective_status": {
      "type": "string",
      "enum": ["in_force", "repealed", "partially_in_force"]
    },
    "official_gazette": {
      "type": "object",
      "required": ["date", "number"],
      "properties": {
        "date": {
          "type": ["string", "null"],
          "format": "date"
        },
        "number": {
          "type": ["string", "null"]
        }
      },
      "additionalProperties": false
    },
    "source_url": {
      "type": "string",
      "format": "uri"
    },
    "language": {
      "type": "string",
      "const": "tr"
    },
    "tags": {
      "type": "array",
      "items": {
        "type": "string"
      }
    },
    "source_mevzuat_id": {
      "type": "string",
      "minLength": 1
    },
    "source_type": {
      "type": "string"
    },
    "content_sha256": {
      "type": "string",
      "pattern": "^[a-f0-9]{64}$"
    },
    "retrieval_api": {
      "type": "string",
      "format": "uri"
    }
  },
  "additionalProperties": false
}
