{
  "law_number": "3670",
  "title": "MİLLİ PİYANGO TEŞKİLİNE DAİR KANUN",
  "slug": "3670-milli-piyango-teskiline-dair-kanun",
  "accepted_date": null,
  "effective_status": "in_force",
  "official_gazette": {
    "date": null,
    "number": null
  },
  "source_url": "https://www.mevzuat.gov.tr/MevzuatMetin/1.3.3670.pdf",
  "language": "tr",
  "tags": [],
  "source_mevzuat_id": "1.3.3670",
  "source_type": "KANUN",
  "content_sha256": "10b2ce7b940856a1abb9d1975bcd6bcb380c6767908678fe4b56a1d0927c63e4",
  "retrieval_api": "https://github.com/openmevzuat/openmevzuat"
}
