{
  "law_number": "831",
  "title": "SULAR HAKKINDA KANUN",
  "slug": "831-sular-hakkinda-kanun",
  "accepted_date": "1926-04-28",
  "effective_status": "in_force",
  "official_gazette": {
    "date": "1926-05-10",
    "number": "368"
  },
  "source_url": "https://mevzuat.adalet.gov.tr/mevzuat/105400",
  "language": "tr",
  "tags": [],
  "source_mevzuat_id": "105400",
  "source_type": "KANUN",
  "content_sha256": "4bda56bf60658bf6ba188349a94e5db7453ef1ded81a3739fae7f6fbfb4d6d4b",
  "retrieval_api": "https://bedesten.adalet.gov.tr/mevzuat/getDocumentContent"
}
