{
  "law_number": "815",
  "title": "TÜRKİYE SAHİLLERİNDE NAKLİYATI BAHRİYE (KABOTAJ) VE LİMANLARLA KARA SULARI DAHİLİNDE İCRAYİ SANAT VE TİCARET HAKKINDA KANUN",
  "slug": "815-turkiye-sahillerinde-nakliyati-bahriye-kabotaj-ve-limanlarla-kara-sulari-dahilinde-icrayi-sanat-ve-ticaret-hakkinda-kanun",
  "accepted_date": "1926-04-19",
  "effective_status": "in_force",
  "official_gazette": {
    "date": "1926-04-29",
    "number": "359"
  },
  "source_url": "https://mevzuat.adalet.gov.tr/mevzuat/105402",
  "language": "tr",
  "tags": [],
  "source_mevzuat_id": "105402",
  "source_type": "KANUN",
  "content_sha256": "279a844709bdaa84ac8e257e466956313a75b0e5659389f576ebdb34b1c8dd7a",
  "retrieval_api": "https://bedesten.adalet.gov.tr/mevzuat/getDocumentContent"
}
