{
  "law_number": "1607",
  "title": "YATILI BÖLGE VE ÖZEL EĞİTİME MUHTAÇ ÇOCUKLARA MAHSUS OKULLARDA DÖNER SERMAYE KURULMASINA DAİR KANUN",
  "slug": "1607-yatili-bolge-ve-ozel-egitime-muhtac-cocuklara-mahsus-okullarda-doner-sermaye-kurulmasina-dair-kanun",
  "accepted_date": null,
  "effective_status": "in_force",
  "official_gazette": {
    "date": null,
    "number": null
  },
  "source_url": "https://www.mevzuat.gov.tr/MevzuatMetin/1.5.1607.pdf",
  "language": "tr",
  "tags": [],
  "source_mevzuat_id": "1.5.1607",
  "source_type": "KANUN",
  "content_sha256": "520fc2a89e2a1c682b3815dacd79e1110477a0fc9d37787eebdfc163f50f3cff",
  "retrieval_api": "https://github.com/openmevzuat/openmevzuat"
}
