{
  "law_number": "4450",
  "title": "BAZI SUÇ FAİLLERİ HAKKINDA UYGULANACAK HÜKÜMLERE DAİR KANUNDA DEĞİŞİKLİK YAPILMASINA İLİŞKİN KANUN",
  "slug": "4450-bazi-suc-failleri-hakkinda-uygulanacak-hukumlere-dair-kanunda-degisiklik-yapilmasina-iliskin-kanun",
  "accepted_date": null,
  "effective_status": "in_force",
  "official_gazette": {
    "date": null,
    "number": null
  },
  "source_url": "https://www.mevzuat.gov.tr/MevzuatMetin/1.5.4450.pdf",
  "language": "tr",
  "tags": [],
  "source_mevzuat_id": "1.5.4450",
  "source_type": "KANUN",
  "content_sha256": "4f411fe76ba0738ab02ff0bccf520fefa00f3635f737205cf36a8d2a634daf6c",
  "retrieval_api": "https://github.com/openmevzuat/openmevzuat"
}
