{
  "law_number": "4357",
  "title": "HUSUSİ İDAREDEN MAAŞ ALAN İLKOKUL ÖĞRETMENLERİNİN KADROLARINA, TERFİ, TALTİF VE CEZALANDIRILMALARINA VE BU ÖĞRETMENLER İÇİN TEŞKİL EDİLECEK SAĞLIK VE İÇTİMAİ YARDIM SANDIĞI İLE YAPI SANDIĞINA VE ÖĞRETMENLERİN ALACAKLARINA DAİR KANUN",
  "slug": "4357-hususi-idareden-maas-alan-ilkokul-ogretmenlerinin-kadrolarina-terfi-taltif-ve-cezalandirilmalarina-ve-bu-ogretmenler-icin-teskil-edilecek-saglik-ve-ictimai-yardim-770b56ff90d4",
  "accepted_date": null,
  "effective_status": "in_force",
  "official_gazette": {
    "date": null,
    "number": null
  },
  "source_url": "https://www.mevzuat.gov.tr/MevzuatMetin/1.3.4357.pdf",
  "language": "tr",
  "tags": [],
  "source_mevzuat_id": "1.3.4357",
  "source_type": "KANUN",
  "content_sha256": "3a46a1cad7cc822bfc2711f534e444acb92662f5c7e4c8f14215f2c419b98415",
  "retrieval_api": "https://github.com/openmevzuat/openmevzuat"
}
