{
  "law_number": "128",
  "title": "OLAĞANÜSTÜ HAL KAPSAMINDA BAZI TEDBİRLERİN ALINMASI HAKKINDA CUMHURBAŞKANLIĞI KARARNAMESİ (KARARNAME NUMARASI: 128)",
  "slug": "128-olaganustu-hal-kapsaminda-bazi-tedbirlerin-alinmasi-hakkinda-cumhurbaskanligi-kararnamesi-kararname-numarasi-128",
  "accepted_date": null,
  "effective_status": "repealed",
  "official_gazette": {
    "date": "2023-03-03",
    "number": "32121"
  },
  "source_url": "https://mevzuat.adalet.gov.tr/mevzuat/336290",
  "language": "tr",
  "tags": [],
  "source_mevzuat_id": "336290",
  "source_type": "MULGA",
  "content_sha256": "0d1e2bba26b97420620af892c5a3289e2d12a9abf3650146ffba86a994a02020",
  "retrieval_api": "https://bedesten.adalet.gov.tr/mevzuat/getDocumentContent"
}
