{
  "law_number": "7310",
  "title": "ATATÜRK ORMAN ÇİFTLİĞİ ARAZİSİNDEN 725 DEKARININ SATILMASI VE EVVELCE MÜBADELE EDİLMİŞ OLAN BİR KISIM ARAZİNİN İLGİLİ ŞAHISLARA FERAĞININ İCRASI HAKKINDA KANUN",
  "slug": "7310-ataturk-orman-ciftligi-arazisinden-725-dekarinin-satilmasi-ve-evvelce-mubadele-edilmis-olan-bir-kisim-arazinin-ilgili-sahislara-ferag-105092",
  "accepted_date": "1959-05-29",
  "effective_status": "in_force",
  "official_gazette": {
    "date": "1959-06-06",
    "number": "10224"
  },
  "source_url": "https://mevzuat.adalet.gov.tr/mevzuat/105092",
  "language": "tr",
  "tags": [],
  "source_mevzuat_id": "105092",
  "source_type": "KANUN",
  "content_sha256": "2aba3ca8a1f95fd61f03aca23a591f032453db9d744ce0454d83bdfd95453788",
  "retrieval_api": "https://bedesten.adalet.gov.tr/mevzuat/getDocumentContent"
}
