{
  "law_number": "6098",
  "title": "Türk Borçlar Kanunu",
  "slug": "6098-turk-borclar-kanunu",
  "accepted_date": "2011-01-11",
  "effective_status": "in_force",
  "official_gazette": {
    "date": "2011-02-04",
    "number": "27836"
  },
  "source_url": "https://www.mevzuat.gov.tr/MevzuatMetin/1.5.6098.pdf",
  "language": "tr",
  "tags": [
    "borclar_hukuku",
    "sozlesmeler",
    "genel_hukumler"
  ],
  "source_mevzuat_id": "1.5.6098",
  "source_type": "KANUN",
  "content_sha256": "033fd6157d4dfb1183f0979e4307018e0dc2bcf0609c2113384c372558940f76",
  "retrieval_api": "https://github.com/openmevzuat/openmevzuat"
}
