{
  "law_number": "7456",
  "title": "6/2/2023 TARİHİNDE MEYDANA GELEN DEPREMLERİN YOL AÇTIĞI EKONOMİK KAYIPLARIN TELAFİSİ İÇİN EK MOTORLU TAŞITLAR VERGİSİ İHDASI İLE BAZI KANUNLARDA VE 375 SAYILI KANUN HÜKMÜNDE KARARNAMEDE DEĞİŞİKLİK YAPILMASI HAKKINDA KANUN",
  "slug": "7456-6-2-2023-tarihinde-meydana-gelen-depremlerin-yol-actigi-ekonomik-kayiplarin-telafisi-icin-ek-motorlu-tasitlar-vergisi-ihdasi-ile-bazi-137474",
  "accepted_date": "2023-07-14",
  "effective_status": "in_force",
  "official_gazette": {
    "date": "2023-07-15",
    "number": "32249"
  },
  "source_url": "https://mevzuat.adalet.gov.tr/mevzuat/137474",
  "language": "tr",
  "tags": [],
  "source_mevzuat_id": "137474",
  "source_type": "KANUN",
  "content_sha256": "1d91dd614976ca232f5da91c7457f81c4c52230b01e8f888060b42e1cc964da6",
  "retrieval_api": "https://bedesten.adalet.gov.tr/mevzuat/getDocumentContent"
}
