{
  "law_number": "5454",
  "title": "T.C. EMEKLİ SANDIĞI, SOSYAL SİGORTALAR KURUMU VE BAĞ-KURDAN AYLIK VEYA GELİR ALMAKTA OLANLARA EK ÖDEME YAPILMASI İLE SOSYAL SİGORTALAR KURUMU VE BAĞ-KURDAN AYLIK VEYA GELİR ALMAKTA OLANLARA ÖDENEN GELİR VE AYLIKLARDA 2006 YILINDA YAPILACAK ARTIŞLAR VE BAZI KANUNLARDA DEĞİŞİKLİK YAPILMASI HAKKINDA KANUN",
  "slug": "5454-t-c-emekli-sandigi-sosyal-sigortalar-kurumu-ve-bag-kurdan-aylik-veya-gelir-almakta-olanlara-ek-odeme-yapilmasi-ile-sosyal-sigortalar-103926",
  "accepted_date": "2006-02-08",
  "effective_status": "in_force",
  "official_gazette": {
    "date": "2006-02-15",
    "number": "26081"
  },
  "source_url": "https://mevzuat.adalet.gov.tr/mevzuat/103926",
  "language": "tr",
  "tags": [],
  "source_mevzuat_id": "103926",
  "source_type": "KANUN",
  "content_sha256": "5b592fcce3f815b58eef99afd8775008206efa991f0769fadf84fc11878c9c53",
  "retrieval_api": "https://bedesten.adalet.gov.tr/mevzuat/getDocumentContent"
}
