{
  "law_number": "5286",
  "title": "KÖY HİZMETLERİ GENEL MÜDÜRLÜĞÜNÜN KALDIRILMASI VE BAZI KANUNLARDA DEĞİŞİKLİK YAPILMASI HAKKINDA KANUN",
  "slug": "5286-koy-hizmetleri-genel-mudurlugunun-kaldirilmasi-ve-bazi-kanunlarda-degisiklik-yapilmasi-hakkinda-kanun",
  "accepted_date": "2005-01-13",
  "effective_status": "in_force",
  "official_gazette": {
    "date": "2005-01-28",
    "number": "25710"
  },
  "source_url": "https://mevzuat.adalet.gov.tr/mevzuat/103852",
  "language": "tr",
  "tags": [],
  "source_mevzuat_id": "103852",
  "source_type": "KANUN",
  "content_sha256": "b51b5d25bb60c947cc509088e9ef02310a2eb5a3d7d8bccab64e69b42e92d75d",
  "retrieval_api": "https://bedesten.adalet.gov.tr/mevzuat/getDocumentContent"
}
