{
  "law_number": "3533",
  "title": "UMUMİ MÜLHAK VE HUSUSİ BÜTÇELERLE İDARE EDİLEN DAİRELER VE BELEDİYELERLE SERMAYESİNİN TAMAMI DEVLETE VEYA BELEDİYE VEYA HUSUSİ İDARELERE AİD DAİRE VE MÜESSESELER ARASINDAKİ İHTİLAFLARIN TAHKİM YOLU İLE HALLİ HAKKINDA KANUN",
  "slug": "3533-umumi-mulhak-ve-hususi-butcelerle-idare-edilen-daireler-ve-belediyelerle-sermayesinin-tamami-devlete-veya-belediye-veya-hususi-idarelere-aid-daire-ve-muesseseler-09f3fdd140a2",
  "accepted_date": null,
  "effective_status": "in_force",
  "official_gazette": {
    "date": null,
    "number": null
  },
  "source_url": "https://www.mevzuat.gov.tr/MevzuatMetin/1.3.3533.pdf",
  "language": "tr",
  "tags": [],
  "source_mevzuat_id": "1.3.3533",
  "source_type": "KANUN",
  "content_sha256": "b699aa039cddaa75cb688698813d387d3d1538f78b72f781b97bc48461c19a1b",
  "retrieval_api": "https://github.com/openmevzuat/openmevzuat"
}
