{
  "law_number": "4358",
  "title": "VERGİ KİMLİK NUMARASI KULLANIMININ YAYGINLAŞTIRILMASI VE NOTERLİK KANUNU, İCRA VE İFLAS KANUNU TAPU KANUNU KARAYOLLARI TRAFİK KANUNU ÇEKLE ÖDEMELERİN DÜZENLENMESİ VE ÇEK HAMİLLERİNİN KORUNMASI HAKKINDA KANUN, BANKALAR KANUNU, POSTA KANUNU İLE PASAPORT KANUNUNDA DEĞİŞİKLİK YAPILMASI HAKKINDA KANUN",
  "slug": "4358-vergi-kimlik-numarasi-kullaniminin-yayginlastirilmasi-ve-noterlik-kanunu-icra-ve-iflas-kanunu-tapu-kanunu-karayollari-trafik-kanunu-cekle-odemelerin-duzenlenmesi-a813e91aa8f3",
  "accepted_date": null,
  "effective_status": "in_force",
  "official_gazette": {
    "date": null,
    "number": null
  },
  "source_url": "https://www.mevzuat.gov.tr/MevzuatMetin/1.5.4358.pdf",
  "language": "tr",
  "tags": [],
  "source_mevzuat_id": "1.5.4358",
  "source_type": "KANUN",
  "content_sha256": "a79070b029135e0020d01653a33cb5dcc8c0ceb1293801e7fd826ed3a48277f0",
  "retrieval_api": "https://github.com/openmevzuat/openmevzuat"
}
