{
  "law_number": "4071",
  "title": "3 MART 1340 (1924)TARİHLİ VE 431 SAYILI KANUNLA HAZİNEYE KALAN TAŞINMAZ MALLARDAN BAZILARININ ZİLYEDLERİNE DEVRİ HAKKINDA KANUN",
  "slug": "4071-3-mart-1340-1924tarihli-ve-431-sayili-kanunla-hazineye-kalan-tasinmaz-mallardan-bazilarinin-zilyedlerine-devri-hakkinda-kanun",
  "accepted_date": null,
  "effective_status": "in_force",
  "official_gazette": {
    "date": null,
    "number": null
  },
  "source_url": "https://www.mevzuat.gov.tr/MevzuatMetin/1.5.4071.pdf",
  "language": "tr",
  "tags": [],
  "source_mevzuat_id": "1.5.4071",
  "source_type": "KANUN",
  "content_sha256": "96f38ab43945c73f7654416d7bfe52468490ac97198951267b10db995f161cd6",
  "retrieval_api": "https://github.com/openmevzuat/openmevzuat"
}
