{
  "law_number": "3465",
  "title": "KARAYOLLARI GENEL MÜDÜRLÜĞÜ DIŞINDAKİ KURULUŞLARIN ERİŞME KONTROLLÜ KARAYOLU (OTOYOL) YAPIMI, BAKIMI VE İŞLETİLMESİ İLE GÖREVLENDİRİLMESİ HAKKINDA KANUN",
  "slug": "3465-karayollari-genel-mudurlugu-disindaki-kuruluslarin-erisme-kontrollu-karayolu-otoyol-yapimi-bakimi-ve-isletilmesi-ile-gorevlendirilmes-104726",
  "accepted_date": "1988-05-28",
  "effective_status": "in_force",
  "official_gazette": {
    "date": "1988-06-02",
    "number": "19830"
  },
  "source_url": "https://mevzuat.adalet.gov.tr/mevzuat/104726",
  "language": "tr",
  "tags": [],
  "source_mevzuat_id": "104726",
  "source_type": "KANUN",
  "content_sha256": "ef105b380f3497cece14f4572abd439cb5f3548212ad3bd1f1642fd7b0ae9d33",
  "retrieval_api": "https://bedesten.adalet.gov.tr/mevzuat/getDocumentContent"
}
